<?xml version="1.0" encoding="UTF-8"?>
<BDGestoria xmlns:xsi="http://www.w3.org/2001/XMLSchema-instance"
    xsi:noNamespaceSchemaLocation="BDGestoria.xsd">

    <Gestoria codigo="">
        <Empleado></Empleado>
        <Fecha></Fecha>
        <Cliente codigo="">
            <Descripción></Descripción>
            <Número></Número>
            <Vivienda id="">
                <Coste></Coste>
                <Resumen></Resumen>
                <Plazo></Plazo>
            </Vivienda>
        </Cliente>
    </Gestoria>
</BDGestoria>